{
  "schema_version": "1.0",
  "sample_id": "s000000-v00",
  "scene_id": "s000000",
  "split": "validation",
  "viewpoint_index": 0,
  "files": {
    "rgb": {
      "path": "rgb/validation/0a/s000000-v00.png",
      "media_type": "image/png",
      "width": 64,
      "height": 64,
      "bytes": 12420,
      "sha256": "75ddede510659a9223bdfe8788a84a75f06929274dcaa62735b06fd9ac180bab"
    },
    "mask": {
      "path": "masks/validation/0a/s000000-v00.png",
      "media_type": "image/png",
      "width": 64,
      "height": 64,
      "bytes": 4228,
      "sha256": "6aa2a5bc9aa46d21741515467a0b18a66cc661fb21f18dbc5bc122da41013785"
    }
  },
  "camera": {
    "player_position": [
      16.5,
      65.0,
      24.5
    ],
    "eye_position": [
      16.5,
      66.62,
      24.5
    ],
    "eye_height_blocks": 1.62,
    "yaw_degrees": 180.0,
    "pitch_degrees": 10.0,
    "forward": [
      -1.2060416625018976E-16,
      -0.17364817766693033,
      -0.984807753012208
    ],
    "right": [
      1.0,
      0.0,
      -1.2246467991473532E-16
    ],
    "up": [
      -2.1265768495757713E-17,
      0.984807753012208,
      -0.17364817766693033
    ]
  },
  "projection": {
    "mode": "PERSPECTIVE_90",
    "overrides": {}
  },
  "capture": {
    "operation_id": "op-s000000-v00",
    "world_tick": 1000,
    "partial_tick": 1.0,
    "ready": true,
    "settling_ticks": 20
  },
  "target": {
    "target_present": true,
    "target_in_projection": true,
    "visible_pixels": 0,
    "unoccluded_pixels": 256,
    "visibility_ratio": 0.0,
    "target_status": "fully_occluded",
    "visible_bbox_xywh": null,
    "visible_centroid_xy": null,
    "distance_blocks": 8.0
  },
  "conditions": {
    "time_of_day_ticks": 6000,
    "weather": "clear",
    "biome": "minecraft:the_void",
    "sky_light": 15,
    "block_light": 0,
    "rgb_mean_luminance": 0.5
  }
}
